,display_title,mpaa_rating,critics_pick,byline,headline,summary_short,publication_date,opening_date,date_updated,link,multimedia
531,Relaxer,,1,JEANNETTE CATSOULIS,‘Relaxer’ Review: Help! He’s Sitting and He Can’t Get Up,"Sad and strange and defiantly gross, Joel Potrykus’s “Relaxer” is a compassionate survival tale swirling with childhood trauma.",2019-03-28,,2019-04-05 16:44:01,"{'type': 'article', 'url': 'https://www.nytimes.com/2019/03/28/movies/relaxer-review.html', 'suggested_link_text': 'Read the New York Times Review of Relaxer'}","{'type': 'mediumThreeByTwo210', 'src': 'https://static01.nyt.com/images/2019/03/29/arts/28relaxer1/relaxer1-mediumThreeByTwo210.jpg', 'height': 140, 'width': 210}"
532,Diane,,1,JEANNETTE CATSOULIS,"‘Diane’ Review: A Vibrant Tale of Love, Sisterhood and Decline","Mary Kay Place is astonishing as a weary widow dealing with guilt, heartache and a diminishing circle of friends.",2019-03-28,2019-03-29,2019-04-27 16:44:02,"{'type': 'article', 'url': 'https://www.nytimes.com/2019/03/28/movies/diane-review.html', 'suggested_link_text': 'Read the New York Times Review of Diane'}","{'type': 'mediumThreeByTwo210', 'src': 'https://static01.nyt.com/images/2019/03/29/arts/29diane1/diane1-mediumThreeByTwo210.jpg', 'height': 140, 'width': 210}"
533,Super Deluxe,,0,RACHEL SALTZ,"‘Super Deluxe’ Review: A Tamil Film, With a Cosmic Indie Vibe","Thiagarajan Kumararaja’s second feature, with multiple spiraling plots, can’t sustain its raffish, oddball tone for three hours.",2019-03-28,2019-03-28,2019-04-15 16:44:02,"{'type': 'article', 'url': 'https://www.nytimes.com/2019/03/28/movies/super-deluxe-review.html', 'suggested_link_text': 'Read the New York Times Review of Super Deluxe'}","{'type': 'mediumThreeByTwo210', 'src': 'https://static01.nyt.com/images/2019/03/29/arts/28superdeluxe/28superdeluxe-mediumThreeByTwo210.jpg', 'height': 140, 'width': 210}"
534,A Vigilante,R,0,MANOHLA DARGIS,‘A Vigilante’ Review: Vengeance Is Hers,"Olivia Wilde stars as an avenger of domestic-abuse victims in Sarah Daggar-Nickson’s satisfyingly lean, mean genre movie.",2019-03-28,2019-03-29,2019-04-05 16:44:01,"{'type': 'article', 'url': 'https://www.nytimes.com/2019/03/28/movies/a-vigilante-review.html', 'suggested_link_text': 'Read the New York Times Review of A Vigilante'}","{'type': 'mediumThreeByTwo210', 'src': 'https://static01.nyt.com/images/2019/03/29/arts/28vigilante-1/28vigilante-1-mediumThreeByTwo210.jpg', 'height': 140, 'width': 210}"
535,Tigerland,,0,BEN KENIGSBERG,‘Tigerland’ Review: Conservation Documentary Lacks Claws,"The film falls into a common trap of advocacy documentaries, which is to inform on an urgent issue without a particularly urgent cinematic narrative to match it.",2019-03-28,2019-03-29,2019-04-05 16:44:01,"{'type': 'article', 'url': 'https://www.nytimes.com/2019/03/28/movies/tigerland-review.html', 'suggested_link_text': 'Read the New York Times Review of Tigerland'}","{'type': 'mediumThreeByTwo210', 'src': 'https://static01.nyt.com/images/2019/03/29/arts/28tigerland1/tigerland1-mediumThreeByTwo210.jpg', 'height': 140, 'width': 210}"
536,The Chaperone,,0,JEANNETTE CATSOULIS,‘The Chaperone’ Review: A Matron and a Movie Star Take a Jazz-Age Journey,Michael Engler’s dull period piece follows a conservative woman who accompanies a young silent film star on a trip to New York City.,2019-03-28,2019-03-29,2019-04-26 02:44:02,"{'type': 'article', 'url': 'https://www.nytimes.com/2019/03/28/movies/the-chaperone-review.html', 'suggested_link_text': 'Read the New York Times Review of The Chaperone'}","{'type': 'mediumThreeByTwo210', 'src': 'https://static01.nyt.com/images/2019/03/26/arts/chaperone1/chaperone1-mediumThreeByTwo210.jpg', 'height': 140, 'width': 210}"
537,Slut in a Good Way,R,0,TEO BUGBEE,‘Slut in a Good Way’ Review: And Then They Staged a Sex Strike,"In this coming-of-age comedy directed by Sophie Lorain, first comes love. Then comes rebellion.",2019-03-28,2019-03-29,2019-04-12 16:44:02,"{'type': 'article', 'url': 'https://www.nytimes.com/2019/03/28/movies/slut-in-a-good-way-review.html', 'suggested_link_text': 'Read the New York Times Review of Slut in a Good Way'}","{'type': 'mediumThreeByTwo210', 'src': 'https://static01.nyt.com/images/2019/03/28/arts/28slutinagoodway/28slutinagoodway-mediumThreeByTwo210.jpg', 'height': 140, 'width': 210}"
538,The Last,,0,GLENN KENNY,‘The Last’ Review: A Revelation Leaves a Family Shattered,"This drama, written and directed by Jeff Lipsky, explores a monstrous idea with complexity.",2019-03-28,,2019-04-12 16:44:02,"{'type': 'article', 'url': 'https://www.nytimes.com/2019/03/28/movies/the-last-review.html', 'suggested_link_text': 'Read the New York Times Review of The Last'}","{'type': 'mediumThreeByTwo210', 'src': 'https://static01.nyt.com/images/2019/03/29/arts/thelast1/thelast1-mediumThreeByTwo210.jpg', 'height': 140, 'width': 210}"
539,The Brink,,1,A.O. SCOTT,‘The Brink’ Review: Considering the Unlikely Charm of Stephen Bannon,This documentary trails the former White House adviser as he tours Europe and America promoting right-wing populist nationalism.,2019-03-27,2019-03-29,2019-04-27 16:44:02,"{'type': 'article', 'url': 'https://www.nytimes.com/2019/03/27/movies/the-brink-review.html', 'suggested_link_text': 'Read the New York Times Review of The Brink'}","{'type': 'mediumThreeByTwo210', 'src': 'https://static01.nyt.com/images/2019/03/29/arts/thebrink-promo/thebrink-promo-mediumThreeByTwo210-v2.jpg', 'height': 140, 'width': 210}"
540,Dumbo,PG,0,MANOHLA DARGIS,Review: ‘Dumbo’ Goes Bonkers in Dreamland,"Tim Burton takes this live-action remake of the 1941 Disney classic to his very own dark place. Michael Keaton, Danny DeVito and Eva Green help.",2019-03-27,2019-03-29,2019-04-27 16:44:02,"{'type': 'article', 'url': 'https://www.nytimes.com/2019/03/27/movies/dumbo-review.html', 'suggested_link_text': 'Read the New York Times Review of Dumbo'}","{'type': 'mediumThreeByTwo210', 'src': 'https://static01.nyt.com/images/2019/03/29/arts/27dumbo-1/27dumbo-1-mediumThreeByTwo210.jpg', 'height': 140, 'width': 210}"
541,The Beach Bum,R,0,A.O. SCOTT,Review: Matthew McConaughey Waxes Poetic in ‘The Beach Bum’,The McConaissance collapses into decadence in Harmony Korine’s latest caper.,2019-03-27,2019-03-29,2019-04-27 16:44:02,"{'type': 'article', 'url': 'https://www.nytimes.com/2019/03/27/movies/the-beach-bum-review.html', 'suggested_link_text': 'Read the New York Times Review of The Beach Bum'}","{'type': 'mediumThreeByTwo210', 'src': 'https://static01.nyt.com/images/2019/03/29/arts/27beachbum/27beachbum-mediumThreeByTwo210-v3.jpg', 'height': 140, 'width': 210}"
542,Working Woman,,0,BEN KENIGSBERG,‘Working Woman’ Review: Plumbing a Toxic Work Environment in Israel,"As it tightens its grip, this feature from Michal Aviad captures how workplace sexual harassment slowly takes over one woman’s life.",2019-03-26,2019-03-29,2019-04-12 16:44:02,"{'type': 'article', 'url': 'https://www.nytimes.com/2019/03/26/movies/working-woman-review.html', 'suggested_link_text': 'Read the New York Times Review of Working Woman'}","{'type': 'mediumThreeByTwo210', 'src': 'https://static01.nyt.com/images/2019/03/27/arts/workingwoman1/workingwoman1-mediumThreeByTwo210.jpg', 'height': 140, 'width': 210}"
543,The Dirt,TV-MA,0,JASON BAILEY,‘The Dirt’ Review: A Badly Bewigged Bummer,"Based on the tell-all book about “Mötley Crüe,” this film adaptation sands down the source material into a junior varsity “Bohemian Rhapsody.”",2019-03-22,2019-03-22,2019-03-22 11:04:03,"{'type': 'article', 'url': 'https://www.nytimes.com/2019/03/22/movies/the-dirt-review.html', 'suggested_link_text': 'Read the New York Times Review of The Dirt'}","{'type': 'mediumThreeByTwo210', 'src': 'https://static01.nyt.com/images/2019/03/22/arts/22thedirt/22thedirt-mediumThreeByTwo210-v2.jpg', 'height': 140, 'width': 210}"
544,Roll Red Roll,,1,JEANNETTE CATSOULIS,‘Roll Red Roll’ Review: A Horrifying Assault in a Small Ohio Town,Nancy Schwartzman’s bone-chilling documentary is a tough but essential watch.,2019-03-21,,2019-04-05 16:44:01,"{'type': 'article', 'url': 'https://www.nytimes.com/2019/03/21/movies/roll-red-roll-review.html', 'suggested_link_text': 'Read the New York Times Review of Roll Red Roll'}","{'type': 'mediumThreeByTwo210', 'src': 'https://static01.nyt.com/images/2019/03/20/arts/rollred1/rollred1-mediumThreeByTwo210.jpg', 'height': 140, 'width': 210}"
545,Maze,,1,JEANNETTE CATSOULIS,‘Maze’ Review: A Prison Break and a Confidence Game,A controlled thriller that invents an intimate subtext for the 1983 escape of imprisoned Irish Republican Army fighters from the fortresslike Maze.,2019-03-21,2019-03-22,2019-03-27 16:44:01,"{'type': 'article', 'url': 'https://www.nytimes.com/2019/03/21/movies/maze-review.html', 'suggested_link_text': 'Read the New York Times Review of Maze'}","{'type': 'mediumThreeByTwo210', 'src': 'https://static01.nyt.com/images/2019/03/21/arts/21MAZEpix/21MAZEpix-mediumThreeByTwo210.jpg', 'height': 140, 'width': 210}"
546,Triple Threat,R,0,BEN KENIGSBERG,"‘Triple Threat’ Review: Fighting, Fighting and More Fighting","In a movie that stars Tony Jaa, Iko Uwais and Tiger Chen, the gaps in the plot may not really matter.",2019-03-21,,2019-03-29 16:44:01,"{'type': 'article', 'url': 'https://www.nytimes.com/2019/03/21/movies/triple-threat-review.html', 'suggested_link_text': 'Read the New York Times Review of Triple Threat'}","{'type': 'mediumThreeByTwo210', 'src': 'https://static01.nyt.com/images/2019/03/22/arts/21triplethreat/21triplethreat-mediumThreeByTwo210.jpg', 'height': 140, 'width': 210}"
547,Sunset,R,0,GLENN KENNY,‘Sunset’ Review: Discovering a Dark Past and a Cataclysmic Future,"In his second feature, the director Laszlo Nemes (“Son of Saul”) applies his near-subjective cinematic style to pre-World War I Budapest.",2019-03-21,2019-03-22,2019-04-19 16:44:02,"{'type': 'article', 'url': 'https://www.nytimes.com/2019/03/21/movies/sunset-review.html', 'suggested_link_text': 'Read the New York Times Review of Sunset'}","{'type': 'mediumThreeByTwo210', 'src': 'https://static01.nyt.com/images/2019/03/18/arts/sunset1/sunset1-mediumThreeByTwo210.jpg', 'height': 140, 'width': 210}"
548,Hotel Mumbai,R,0,BEN KENIGSBERG,‘Hotel Mumbai’ Review: Terrorism as Popcorn Movie?,The film re-creates the November 2008 terrorist attacks in Mumbai through the eyes of a sprawling international ensemble.,2019-03-21,2019-03-22,2019-04-21 16:44:02,"{'type': 'article', 'url': 'https://www.nytimes.com/2019/03/21/movies/hotel-mumbai-review.html', 'suggested_link_text': 'Read the New York Times Review of Hotel Mumbai'}","{'type': 'mediumThreeByTwo210', 'src': 'https://static01.nyt.com/images/2019/03/22/arts/22hotel1/hotel1-mediumThreeByTwo210.jpg', 'height': 140, 'width': 210}"
549,Out of Blue,,0,GLENN KENNY,‘Out of Blue’ Review: Seeking a Suspect in a Suspect Adaptation,"Based on the Martin Amis murder mystery “Night Train,” the movie retains several of its central characters but very little else.",2019-03-21,2019-03-22,2019-03-29 16:44:01,"{'type': 'article', 'url': 'https://www.nytimes.com/2019/03/21/movies/out-of-blue-review.html', 'suggested_link_text': 'Read the New York Times Review of Out of Blue'}","{'type': 'mediumThreeByTwo210', 'src': 'https://static01.nyt.com/images/2019/03/22/arts/21outofblue/21outofblue-mediumThreeByTwo210-v2.jpg', 'height': 140, 'width': 210}"
550,Ramen Shop,,0,BEN KENIGSBERG,‘Ramen Shop’ Review: A Search for Family and Good Soup,"This film demonstrates the power of delicious cuisine to spice up an otherwise straightforward, sentimental film.",2019-03-21,2019-03-22,2019-04-12 16:44:02,"{'type': 'article', 'url': 'https://www.nytimes.com/2019/03/21/movies/ramen-shop-review.html', 'suggested_link_text': 'Read the New York Times Review of Ramen Shop'}","{'type': 'mediumThreeByTwo210', 'src': 'https://static01.nyt.com/images/2019/03/20/arts/ramen1/merlin_152238174_1a266208-fc5a-4d3b-9cc2-1d0209517c10-mediumThreeByTwo210.jpg', 'height': 140, 'width': 210}"
551,Us,R,1,MANOHLA DARGIS,‘Us’ Review: Jordan Peele’s Creepy Latest Turns a Funhouse Mirror on Us,The director of “Get Out” returns with a horror movie about a family terrorized by weird doubles. A dazzling Lupita Nyong’o heads up the terrific cast.,2019-03-20,2019-03-22,2019-04-20 16:44:02,"{'type': 'article', 'url': 'https://www.nytimes.com/2019/03/20/movies/us-movie-review.html', 'suggested_link_text': 'Read the New York Times Review of Us'}","{'type': 'mediumThreeByTwo210', 'src': 'https://static01.nyt.com/images/2019/03/22/arts/22US-Cover/22US-Cover-mediumThreeByTwo210.jpg', 'height': 140, 'width': 210}"
552,Dragged Across Concrete,R,0,MANOHLA DARGIS,‘Dragged Across Concrete’ Review: The Evil That Men Do (Repeatedly),"This neo-exploitation potboiler about brutal men on both sides of the law stars Mel Gibson and Vince Vaughn, and traffics in sordid, ugly shocks.",2019-03-20,2019-03-22,2019-03-29 16:44:01,"{'type': 'article', 'url': 'https://www.nytimes.com/2019/03/20/movies/dragged-across-concrete-review.html', 'suggested_link_text': 'Read the New York Times Review of Dragged Across Concrete'}","{'type': 'mediumThreeByTwo210', 'src': 'https://static01.nyt.com/images/2019/03/20/arts/20draggedacross-1/20draggedacross-1-mediumThreeByTwo210.jpg', 'height': 140, 'width': 210}"
553,Buddy,,1,Wesley Morris,‘Buddy’ Review: Who’s a Good Pup? This Pack of Lifesavers,The director Heddy Honigmann uses her documentary skills — and her humanity — to illuminate the relationships between service animals and their people.,2019-03-19,2019-03-20,2019-04-12 16:44:02,"{'type': 'article', 'url': 'https://www.nytimes.com/2019/03/19/movies/buddy-review.html', 'suggested_link_text': 'Read the New York Times Review of Buddy'}","{'type': 'mediumThreeByTwo210', 'src': 'https://static01.nyt.com/images/2019/03/20/arts/19buddypix/merlin_152237916_fb04f316-29b6-41d0-a36f-34fabe3d9a4e-mediumThreeByTwo210.jpg', 'height': 140, 'width': 210}"
554,Girl,R,0,CHRIS VOGNAR,‘Girl’ Review: A Transgender Portrait of Uncommon Depth,This divisive film about a young dancer wisely disposes of “will they find out?” questions in favor of psychological depth and verisimilitude.,2019-03-15,2019-03-15,2019-03-15 12:04:03,"{'type': 'article', 'url': 'https://www.nytimes.com/2019/03/15/movies/girl-review.html', 'suggested_link_text': 'Read the New York Times Review of Girl'}","{'type': 'mediumThreeByTwo210', 'src': 'https://static01.nyt.com/images/2019/03/15/arts/15girl/15girl-mediumThreeByTwo210.jpg', 'height': 140, 'width': 210}"
555,The Eyes of Orson Welles,,1,GLENN KENNY,‘The Eyes of Orson Welles’ Review: An Idiosyncratic Look at an Enigmatic Master,"With an unapologetically personal approach, Mark Cousins finds new things to say about a filmmaker whose work has already prompted volumes.",2019-03-14,2019-03-15,2019-03-29 16:44:01,"{'type': 'article', 'url': 'https://www.nytimes.com/2019/03/14/movies/the-eyes-of-orson-welles-review.html', 'suggested_link_text': 'Read the New York Times Review of The Eyes of Orson Welles'}","{'type': 'mediumThreeByTwo210', 'src': 'https://static01.nyt.com/images/2019/03/15/arts/15eyesoforson-print/14eyesoforson-mediumThreeByTwo210-v2.jpg', 'height': 140, 'width': 210}"
556,Knife+Heart,,1,GLENN KENNY,‘Knife + Heart’ Review: Gay Porn and Murder in ’70s Paris,"The film, directed by Yann Gonzalez, is a not-quite-nostalgic evocation of dangerous gay living in the pre-AIDS era.",2019-03-14,2019-03-15,2019-04-07 16:44:02,"{'type': 'article', 'url': 'https://www.nytimes.com/2019/03/14/movies/knife-and-heart-review.html', 'suggested_link_text': 'Read the New York Times Review of Knife+Heart'}","{'type': 'mediumThreeByTwo210', 'src': 'https://static01.nyt.com/images/2019/03/14/arts/14knifeandheart/14knifeandheart-mediumThreeByTwo210.jpg', 'height': 140, 'width': 210}"
557,The Juniper Tree,,1,GLENN KENNY,‘The Juniper Tree’ Review: A Young Björk Enchants in Her Film Acting Debut,"Nietzchka Keene wrote, directed and edited the movie, which was adapted from a Brothers Grimm tale.",2019-03-14,,2019-04-05 16:44:01,"{'type': 'article', 'url': 'https://www.nytimes.com/2019/03/14/movies/the-juniper-tree-review.html', 'suggested_link_text': 'Read the New York Times Review of The Juniper Tree'}","{'type': 'mediumThreeByTwo210', 'src': 'https://static01.nyt.com/images/2019/03/15/arts/15thejunipertree-print/14thejunipertree-mediumThreeByTwo210.jpg', 'height': 140, 'width': 210}"
558,The Highwaymen,R,0,A.O. SCOTT,‘The Highwaymen’ Review: Grumpy Old Men on the Trail of Glamorous Killers,"Bonnie and Clyde’s story is retold from the point of view of their executioners, played by Kevin Costner and Woody Harrelson.",2019-03-14,2019-03-29,2019-03-29 16:44:01,"{'type': 'article', 'url': 'https://www.nytimes.com/2019/03/14/movies/the-highwaymen-review.html', 'suggested_link_text': 'Read the New York Times Review of The Highwaymen'}","{'type': 'mediumThreeByTwo210', 'src': 'https://static01.nyt.com/images/2019/03/15/arts/15thehighwaymen-print1/15thehighwaymen-print1-mediumThreeByTwo210-v2.jpg', 'height': 140, 'width': 210}"
559,The Mustang,R,0,MANOHLA DARGIS,‘The Mustang’ Review: Where the Wild Things Roam. And Sometimes Break Out.,"This film is a seductively heartfelt melodrama about a violent inmate and a wild horse, brought together in a rehabilitation program to gentle each other.",2019-03-14,2019-03-15,2019-04-14 16:44:02,"{'type': 'article', 'url': 'https://www.nytimes.com/2019/03/14/movies/the-mustang-review.html', 'suggested_link_text': 'Read the New York Times Review of The Mustang'}","{'type': 'mediumThreeByTwo210', 'src': 'https://static01.nyt.com/images/2019/03/15/arts/15mustang-1/15mustang-1-mediumThreeByTwo210-v2.jpg', 'height': 140, 'width': 210}"
560,Five Feet Apart,PG-13,0,BEN KENIGSBERG,‘Five Feet Apart’ Review: Ailing Teenagers Live Dangerously for Love,Haley Lu Richardson and Cole Sprouse navigate the rules of attraction and of a hospital in this film about living with cystic fibrosis.,2019-03-14,2019-03-15,2019-04-14 16:44:02,"{'type': 'article', 'url': 'https://www.nytimes.com/2019/03/14/movies/five-feet-apart-review.html', 'suggested_link_text': 'Read the New York Times Review of Five Feet Apart'}","{'type': 'mediumThreeByTwo210', 'src': 'https://static01.nyt.com/images/2019/03/14/arts/14fivefeetapart/merlin_151806072_a3d01c8d-3a46-4db1-a1b5-0e58bf599855-mediumThreeByTwo210.jpg', 'height': 140, 'width': 210}"
561,Wonder Park,PG,0,TEO BUGBEE,‘Wonder Park’ Review: An Animated Amusement Park Adventure Stalls Visually,"In “Wonder Park,” a child’s imagination powers an amusement park. Unfortunately, the movie falls shy of providing the same sensory thrill ride.",2019-03-14,2019-03-15,2019-04-14 16:44:02,"{'type': 'article', 'url': 'https://www.nytimes.com/2019/03/14/movies/wonder-park-review.html', 'suggested_link_text': 'Read the New York Times Review of Wonder Park'}","{'type': 'mediumThreeByTwo210', 'src': 'https://static01.nyt.com/images/2019/03/13/arts/wonderpark1/wonderpark1-mediumThreeByTwo210.jpg', 'height': 140, 'width': 210}"
562,The Hummingbird Project,R,0,BEN KENIGSBERG,‘The Hummingbird Project’ Review: They’re Running Cable and Chasing Money,"Jesse Eisenberg and Alexander Skarsgard star in this thriller, set at the intersection of technology and high finance.",2019-03-14,2019-03-15,2019-04-05 16:44:01,"{'type': 'article', 'url': 'https://www.nytimes.com/2019/03/14/movies/the-hummingbird-project-review.html', 'suggested_link_text': 'Read the New York Times Review of The Hummingbird Project'}","{'type': 'mediumThreeByTwo210', 'src': 'https://static01.nyt.com/images/2019/03/14/arts/14thehummingbird/14thehummingbird-mediumThreeByTwo210.jpg', 'height': 140, 'width': 210}"
563,Iceman,,0,JEANNETTE CATSOULIS,‘Iceman’ Review: Retribution in the Neolithic Age,Felix Randau’s elemental drama reconstructs the possible last days of Europe’s best-preserved mummy with wide-screen pizazz.,2019-03-14,2019-03-15,2019-03-22 16:44:01,"{'type': 'article', 'url': 'https://www.nytimes.com/2019/03/14/movies/the-iceman-review.html', 'suggested_link_text': 'Read the New York Times Review of Iceman'}","{'type': 'mediumThreeByTwo210', 'src': 'https://static01.nyt.com/images/2019/03/13/arts/iceman1/iceman1-mediumThreeByTwo210.jpg', 'height': 140, 'width': 210}"
564,Combat Obscura,,0,BEN KENIGSBERG,‘Combat Obscura’ Review: Afghanistan Uncensored,"This movie was directed and shot by an American Marine and his comrades in Afghanistan, and it presents a patchwork picture of a confusing war.",2019-03-14,2019-03-15,2019-03-22 16:44:01,"{'type': 'article', 'url': 'https://www.nytimes.com/2019/03/14/movies/combat-obscura-review.html', 'suggested_link_text': 'Read the New York Times Review of Combat Obscura'}","{'type': 'mediumThreeByTwo210', 'src': 'https://static01.nyt.com/images/2019/03/15/arts/15COMBATOBSCURAPIX/15COMBATOBSCURAPIX-mediumThreeByTwo210.jpg', 'height': 140, 'width': 210}"
565,The Aftermath,R,0,JEANNETTE CATSOULIS,‘The Aftermath’ Review: Illicit Passion in Postwar Hamburg,"Keira Knightley, Alexander Skarsgard and Jason Clarke star in this stagy drama directed by James Kent based on Rhidian Brook’s 2013 novel.",2019-03-14,2019-03-15,2019-04-14 16:44:02,"{'type': 'article', 'url': 'https://www.nytimes.com/2019/03/14/movies/the-aftermath-review.html', 'suggested_link_text': 'Read the New York Times Review of The Aftermath'}","{'type': 'mediumThreeByTwo210', 'src': 'https://static01.nyt.com/images/2019/03/15/arts/15theaftermath1/15theaftermath1-mediumThreeByTwo210.jpg', 'height': 140, 'width': 210}"
566,Yardie,,0,JEANNETTE CATSOULIS,‘Yardie’ Review: A Gangland Thriller with a Shot of Reggae,"Set in Jamaica and London, Idris Elba’s big-screen directing debut lacks a focused screenplay and a comprehensible lead character.",2019-03-14,,2019-03-22 16:44:01,"{'type': 'article', 'url': 'https://www.nytimes.com/2019/03/14/movies/yardie-review.html', 'suggested_link_text': 'Read the New York Times Review of Yardie'}","{'type': 'mediumThreeByTwo210', 'src': 'https://static01.nyt.com/images/2019/03/13/arts/yardie1/yardie1-mediumThreeByTwo210.jpg', 'height': 140, 'width': 210}"
567,Ash Is Purest White,,1,A.O. SCOTT,‘Ash Is Purest White’ Review: Love Smolders and Crime Pays in a Changing China,"In Jia Zhangke’s enthralling new feature, Zhao Tao and Liao Fan portray an underworld power couple at the mercy of time and fate.",2019-03-13,2019-03-15,2019-04-13 16:44:02,"{'type': 'article', 'url': 'https://www.nytimes.com/2019/03/13/movies/ash-is-purest-white-review.html', 'suggested_link_text': 'Read the New York Times Review of Ash Is Purest White'}","{'type': 'mediumThreeByTwo210', 'src': 'https://static01.nyt.com/images/2019/03/15/arts/13ASHISPUREST-1/merlin_151805493_7787d461-43d1-49d7-be26-a69e97b02cfb-mediumThreeByTwo210.jpg', 'height': 140, 'width': 210}"
568,Rezo,,0,BEN KENIGSBERG,"‘Rezo’ Review: The Life of an Artist, From His Own Hand",This Russian-language feature combines documentary and animation to tell the story of the director’s father.,2019-03-12,,2019-03-20 16:44:01,"{'type': 'article', 'url': 'https://www.nytimes.com/2019/03/12/movies/rezo-review.html', 'suggested_link_text': 'Read the New York Times Review of Rezo'}","{'type': 'mediumThreeByTwo210', 'src': 'https://static01.nyt.com/images/2019/03/12/arts/12rezo/12rezo-mediumThreeByTwo210.jpg', 'height': 140, 'width': 210}"
569,Lady J,,0,HELEN T. VERONGOS,‘Lady J’ Review: The Aristocratic Art of Getting Even,"The Marquis des Arcis is a serial womanizer, but how does he do it? What he lacks in sartorial finesse he doesn’t make up for in charm.",2019-03-08,,2019-03-08 22:16:02,"{'type': 'article', 'url': 'https://www.nytimes.com/2019/03/08/movies/lady-j-review.html', 'suggested_link_text': 'Read the New York Times Review of Lady J'}","{'type': 'mediumThreeByTwo210', 'src': 'https://static01.nyt.com/images/2019/03/08/arts/08ladyj/merlin_151713903_f59cffc4-ee85-4b1b-a9d5-d9d2023e477b-mediumThreeByTwo210.jpg', 'height': 140, 'width': 210}"
570,Juanita,,0,CANDICE FREDERICK,‘Juanita’ Review: A Heartfelt Rallying Cry for Black Women Sabbaticals,The film is a testament to how necessary and urgent it is for black women to embark on purely selfish adventures in order to rediscover themselves.,2019-03-08,2019-03-08,2019-03-08 13:04:02,"{'type': 'article', 'url': 'https://www.nytimes.com/2019/03/08/movies/juanita-review.html', 'suggested_link_text': 'Read the New York Times Review of Juanita'}","{'type': 'mediumThreeByTwo210', 'src': 'https://static01.nyt.com/images/2019/03/08/arts/08juanita/merlin_151706769_17b4f205-4a4b-4602-80ba-1c5bb7687ee1-mediumThreeByTwo210.jpg', 'height': 140, 'width': 210}"
571,Gloria Bell,R,1,MANOHLA DARGIS,‘Gloria Bell’ Review: Love Is in the Air for a Transcendent Julianne Moore,The Chilean writer-director Sebastián Lelio finds a perfect partner in Moore for this fantastic remake of his 2013 movie “Gloria.”,2019-03-07,2019-03-08,2019-04-07 16:44:02,"{'type': 'article', 'url': 'https://www.nytimes.com/2019/03/07/movies/gloria-bell-review.html', 'suggested_link_text': 'Read the New York Times Review of Gloria Bell'}","{'type': 'mediumThreeByTwo210', 'src': 'https://static01.nyt.com/images/2019/03/08/arts/08gloriabell-print-1/08gloriabell-print-1-mediumThreeByTwo210-v2.jpg', 'height': 140, 'width': 210}"
